{
    "class_name": "ExampleAnimationStateMachine",
    "options": {
        "animation_name_kind": "constant"
    },
    "constants": {
        "state_machine": [
            { "constant": { "SM_CROUCHING": "crouching" }, "type": "bool", "setter_name": "set_crouching" },
            { "constant": { "SM_WALKING": "walking" }, "type": "bool", "setter_name": "set_walking" },
            { "constant": { "SM_ON_AIR": "on_air" }, "type": "bool", "setter_name": "set_on_air" }
        ],
        "animation_names": [
            { "ANIM_IDLE": "idle" },
            { "ANIM_CROUCH": "crouch" },
            { "ANIM_RUN": "run" },
            { "ANIM_JUMP": "jump" }
        ]
    },
    "entry_points": [
        { "name": "IdleState" },
        { "name": "CrouchState" },
        { "name": "RunState" },
        { "name": "JumpState" }
    ],
    "states": [
        {
            "name": "IdleState",
            "description": "Idle, not running",
            "animation_name": "ANIM_IDLE",
            "transitions": [
                { "state": "RunState", "conditions": "SM_WALKING" },
                { "state": "CrouchState", "conditions": "SM_CROUCHING" }
            ]
        },
        {
            "name": "CrouchState",
            "description": "Crouching, not running",
            "animation_name": "ANIM_CROUCH",
            "transitions": [
                { "state": "IdleState", "conditions": "not SM_CROUCHING" }
            ]
        },
        {
            "name": "RunState",
            "description": "Run state",
            "animation_name": "ANIM_RUN",
            "transitions": [
                { "state": "IdleState", "conditions": "not SM_WALKING" }
            ]
        },
        {
            "name": "JumpState",
            "description": "On air",
            "animation_name": "ANIM_JUMP",
            "transitions": [
                { "state": "IdleState", "conditions": "not SM_ON_AIR" }
            ],
            "on_end": [
                { "state": "IdleState" }
            ]
        }
    ]
}
